{
  "schema_version": "0.1.0",
  "id": "example-agent",
  "name": "Example Agent",
  "summary": "Synthetic Agent used only to validate the registry contract.",
  "coverage_tier": "C",
  "source_availability": "open",
  "homepage": "https://example.com/agent",
  "upstream": {
    "documentation": "https://example.com/agent/docs",
    "release_feed": "https://example.com/agent/releases",
    "repositories": [
      {
        "component": "cli",
        "url": "https://example.com/agent/repository",
        "default_branch": "main"
      }
    ]
  },
  "licenses": [
    {
      "component": "cli",
      "spdx": "Apache-2.0",
      "url": "https://example.com/agent/license"
    }
  ],
  "surfaces": ["cli", "sdk"],
  "model_strategy": ["multi-provider"],
  "lifecycle": "active",
  "tags": ["synthetic-fixture"],
  "stewards": ["foundation-maintainers"],
  "snapshots": [
    {
      "id": "example-agent-2026-08-10-cli",
      "observed_at": "2026-08-10",
      "surface": "cli",
      "version": "0.1.0",
      "freshness": "current",
      "docs_captured_at": "2026-08-10",
      "source_ref": {
        "repository": "https://example.com/agent/repository",
        "commit": "0000000000000000000000000000000000000000",
        "paths": ["src/loop.ts", "src/tools.ts"]
      },
      "environment": {
        "os": "synthetic",
        "runtime": "synthetic-runtime",
        "permission_mode": "ask",
        "sandbox_mode": "workspace-write",
        "network_mode": "off"
      },
      "claims_path": "registry/examples/example-claim.claim.json",
      "notes": "This snapshot is a schema fixture, not a real product observation."
    }
  ]
}
